<?xml version="1.0" encoding="UTF-8"?>
<!DOCTYPE branches SYSTEM "branches.dtd">
<branches>
  <branch>
    <location>Surry Hills</location>
    <address>76 Devonshire St, Surry Hills NSW</address>
    <phone>02 9211 1234</phone>
    <hours>
      <weekday>Mon - Fri: 6:00 to 14:30</weekday>
      <weekend>Sat - Sun: 7:00 to 15:00</weekend>
    </hours>
    <googleMapLink>https://maps.google.com/?q=76+Devonshire+St,+Surry+Hills+NSW</googleMapLink>
  </branch>
  
  <branch>
    <location>Haymarket</location>
    <address>451 Pitt St, Haymarket Sydney NSW</address>
    <phone>02 9262 5678</phone>
    <hours>
      <weekday>Mon - Fri: 6:00 to 16:00</weekday>
      <weekend>Sat - Sun: 7:00 to 15:00</weekend>
    </hours>
    <googleMapLink>https://maps.google.com/?q=451+Pitt+St,+Haymarket+Sydney+NSW</googleMapLink>
  </branch>
  
  <branch>
    <location>Circular Quay</location>
    <address>31 Alfred Street, Circular Quay NSW</address>
    <phone>02 8971 9101</phone>
    <hours>
      <weekday>Mon - Fri: 6:00 to 16:00</weekday>
      <weekend>Sat - Sun: 7:00 to 15:00</weekend>
    </hours>
    <googleMapLink>https://maps.google.com/?q=31+Alfred+Street,+Circular+Quay+NSW</googleMapLink>
  </branch>
</branches>